branch,sub_branch,region,entity_category,year,entity,entity_inception_year,event_type,target,round_or_event,amount_usd,role,notes,source_url
"fueling AI","real estate","US","operator",1998,"Equinix",1998,"entity_inception","","Company founded","","","Global colocation and interconnection giant scaling AI capacity and distributed AI infrastructure.","https://www.equinix.com/"
"fueling AI","real estate","US","operator",2004,"Digital Realty",2004,"entity_inception","","Company founded","","","One of the largest global data-center landlords and hyperscale campus developers.","https://www.digitalrealty.com/"
"fueling AI","real estate","US","operator",2003,"QTS",2003,"entity_inception","","Company founded","","","Hyperscale-focused data-center operator whose value surged in the AI infrastructure boom.","https://www.qtsdatacenters.com/"
"fueling AI","real estate","US","capital_owner",1985,"Blackstone",1985,"entity_inception","","Company founded","","","Private-capital giant with major exposure to data-center land and development through QTS and joint ventures.","https://www.blackstone.com/"
"fueling AI","real estate","US","operator",1983,"Iron Mountain Data Centers",1983,"entity_inception","","Company founded","","","Real-estate and digital-infrastructure operator benefiting from AI-driven colocation demand.","https://www.ironmountain.com/data-centers"
"fueling AI","real estate","Australia","operator",1989,"Goodman Group",1989,"entity_inception","","Company founded","","","Industrial property and infrastructure developer with rising exposure to data-center land and campuses.","https://www.goodman.com/"
"fueling AI","real estate","US","capital_owner",2023,"Blackstone",1985,"joint_venture","Digital Realty hyperscale campuses","JV announcement","7000000000","partner","Blackstone and Digital Realty announced a $7B hyperscale data-center development JV.","https://www.blackstone.com/news/press/digital-realty-and-blackstone-announce-7-billion-hyperscale-data-center-development-joint-venture/"
"fueling AI","real estate","US","operator",2025,"Digital Realty",2004,"capacity_expansion","AI-driven data-center pipeline","Expansion","","operator","S&P Global reported Digital Realty ramping development as AI demand accelerated.","https://www.spglobal.com/market-intelligence/en/news-insights/articles/2025/6/digital-realty-equinix-ramp-up-datacenters-as-ai-drives-demand-90542889"
"fueling AI","real estate","US","operator",2025,"Equinix",1998,"capacity_expansion","AI infrastructure","Expansion","","operator","S&P Global reported Equinix expanding capacity and investment plans because of AI demand.","https://www.spglobal.com/market-intelligence/en/news-insights/articles/2025/6/digital-realty-equinix-ramp-up-datacenters-as-ai-drives-demand-90542889"
