branch,sub_branch,region,entity_category,year,entity,entity_inception_year,event_type,target,round_or_event,amount_usd,role,notes,source_url
"making & understanding AI","tooling & frameworks","US","framework",2016,"PyTorch",2016,"entity_inception","","Framework released","","","The dominant deep-learning framework for research and much of production AI.","https://pytorch.org/"
"making & understanding AI","tooling & frameworks","US","framework",2018,"JAX",2018,"entity_inception","","Framework released","","","Google-led numerical computing framework central to cutting-edge model research.","https://jax.readthedocs.io/"
"making & understanding AI","tooling & frameworks","US","platform",2016,"Hugging Face",2016,"entity_inception","","Company founded","","","Developer platform and model hub that became core AI distribution infrastructure.","https://huggingface.co/"
"making & understanding AI","tooling & frameworks","US","framework",2023,"vLLM",2023,"entity_inception","","Project released","","","Open-source inference engine central to high-throughput LLM serving.","https://vllm.ai/"
"making & understanding AI","tooling & frameworks","US","framework",2022,"LangChain",2022,"entity_inception","","Project launched","","","Popular orchestration framework for LLM application building and agent workflows.","https://www.langchain.com/"
"making & understanding AI","tooling & frameworks","US","framework",2023,"Ollama",2023,"entity_inception","","Project launched","","","Local model packaging and inference tool that helped normalize desktop open-model usage.","https://ollama.com/"
